location,description,issue_type,urgency
Bhadrak,Garbage piling up outside hospital premises,garbage,low
Rayagada,Water supply restored after long outage,water,low
Paradeep,Pothole on harbor road near fish market,pothole,medium
Koraput,Streetlight outage in hillside locality,streetlight,high
Sundargarh,Garbage not collected for two days in town center,garbage,high
Phulbani,Water pipeline leak under market street,water,medium
Bhubaneswar,large pothole on main arterial road causing traffic delays,pothole,high
Cuttack,streetlight not functioning near market square,streetlight,medium
Rourkela,garbage needs pickup near residential colony,garbage,low
Berhampur,water supply disrupted in ward 12,water,high
Sambalpur,pothole on bridge causing slow traffic,pothole,medium
Puri,streetlight flickering but sometimes stays off,streetlight,low
Balasore,garbage bins overflowing near bus stop,garbage,high
Baripada,water supply irregular in slum area,water,medium
Jharsuguda,pothole at junction causing bike accidents,pothole,high
Angul,streetlight outage in industrial area,streetlight,medium
Dhenkanal,garbage pickup delayed in market area,garbage,low
Kendrapara,water line leak near riverbank,water,high
Bargarh,pothole in outer ring road causing traffic jams,pothole,medium
Jeypore,streetlight out in residential colony,streetlight,low
Bhadrak,garbage not collected in evening shift,garbage,medium
Rayagada,water supply intermittent during evening,water,low
Paradeep,pothole near port road affecting trucks,pothole,high
Koraput,streetlight in hillside colony not working,streetlight,medium
Sundargarh,garbage piling up near the market square,garbage,high
Phulbani,water supply restored but pressure low,water,low
Bhubaneswar,large pothole on main road causing traffic slowdowns,pothole,high
Cuttack,streetlight not working on ring road after dusk,streetlight,medium
Rourkela,garbage dump not cleared in a congested lane,garbage,low
Berhampur,water supply disrupted in several neighborhoods,water,high
Sambalpur,public park littered with plastic waste,garbage,medium
Puri,pothole near temple junction causing traffic build-up,pothole,high
Balasore,streetlight fuse blown leading to dark streets at night,streetlight,low
Baripada,drinking water line leakage in residential area,water,medium
Jharsuguda,garbage not collected in market area,garbage,high
Angul,water shortage during afternoon peak hours,water,low
Dhenkanal,pothole causing road damage near school,pothole,medium
Kendrapara,streetlight not lighting in main thoroughfare,streetlight,high
Bargarh,garbage pile-up behind market complex,garbage,medium
Jeypore,water supply slow and irregular in ward 5,water,low
Bhadrak,pothole near bus stand obstructing traffic,pothole,high
Rayagada,streetlight outage affecting residential lanes,streetlight,medium
Paradeep,garbage collection irregular in coastal area,garbage,low
Koraput,water contamination alert near public tap,water,high
Sundargarh,pothole repairs pending on highway stretch,pothole,medium
Phulbani,streetlight flickering during monsoon,streetlight,low
Bhubaneswar,Large pothole on main artery near Rotary Circle causing traffic slowdowns,pothole,high
Cuttack,Streetlight not working on Jessore Road leading to poor visibility at night,streetlight,medium
Puri,Garbage bins overflowing near the temple complex,garbage,high
Rourkela,Water supply disruption in sector 5 due to broken main pipe,water,high
Berhampur,"Road sinkhole developing after recent rain, needs urgent repair",pothole,high
Sambalpur,Dusty street with litter near market square; request for regular cleanup,garbage,low
Puri,"Streetlight flickering on LT Road, intermittently dark",streetlight,low
Balasore,Municipal water supply intermittent during evenings,water,medium
Jeypore,Pothole near hospital entrance causing vehicle damage,pothole,medium
Kendrapara,Garbage collection delay in ward 4 leading to foul smell,garbage,high
Mayurbhanj,Water tank truck not arriving on schedule; residents without supply,water,low
Angul,Pothole at intersection near college affecting commuters,pothole,medium
Cuttack,Streetlight outages near Cuttack Road crossing,streetlight,high
Ganjam,Garbage piled up behind market; sanitation team not responding,garbage,high
Dhenkanal,Water leakage under flyover causing damp road,water,medium
Sundargarh,Public park drainage blocked; water stagnation observed,others,low
Sonepur,Pothole on NH5 near bridge; risk to bikes,pothole,high
Phulbani,Streetlight out for weeks in town square,streetlight,low
Baripada,Overflowing garbage bins near bus stand,garbage,medium
Nayagarh,Water supply disruption during peak hours in colonies,water,high
Bhubaneswar,large pothole on main road near Raj Bhavan,pothole,high
Cuttack,streetlight not working in Patapada lane,streetlight,medium
Rourkela,garbage accumulation near Market Square,garbage,low
Berhampur,water supply disrupted for residents,water,high
Sambalpur,pothole causing traffic at crossroad,pothole,medium
Puri,streetlight bulb flickering near beach,streetlight,low
Balasore,garbage bins overflowing in market area,garbage,medium
Baripada,water line leak in residential colony,water,high
Jharsuguda,sinkhole near bus stand,pothole,high
Angul,streetlight outage on NH,streetlight,medium
Dhenkanal,garbage not collected from ward 12,garbage,low
Kendrapara,water supply irregular in coastal block,water,medium
Bargarh,pothole near jail road,pothole,low
Jeypore,streetlight out near market complex,streetlight,high
Bhadrak,garbage dumping at nullah bank,garbage,low
Rayagada,water supply restored after outage,water,low
Paradeep,pothole on main highway approaching port,pothole,high
Koraput,streetlight in hill road not functioning,streetlight,medium
Sundargarh,garbage pickup delayed in township,garbage,medium
Phulbani,water tank empty in local council colony,water,high
Bhubaneswar,large pothole on main road near Puri Street,pothole,high
Cuttack,streetlight not working around CDA circle,streetlight,medium
Rourkela,garbage not collected in ward 12,garbage,low
Berhampur,water leakage from main supply line,water,high
Sambalpur,pothole near market area causing traffic,pothole,medium
Puri,streetlight outage along coastal road,streetlight,low
Balasore,garbage littering on beach road,garbage,medium
Baripada,water supply disrupted in residential colony,water,high
Jharsuguda,pothole repaired but new crack appearing,pothole,low
Angul,streetlight flickering in market area,streetlight,medium
Dhenkanal,garbage bins overflowing near hospital,garbage,high
Kendrapara,water pump not functioning in ward 3,water,high
Bargarh,pothole on highway causing jolt to commuters,pothole,medium
Jeypore,streetlight outage near school premises,streetlight,low
Bhadrak,garbage dump near temple area,garbage,medium
Rayagada,water leakage from old pipe near market,water,high
Paradeep,pothole blocks drainage on port road,pothole,high
Koraput,streetlight not turning on after dusk,streetlight,medium
Sundargarh,garbage not collected in industrial area,garbage,low
Phulbani,water supply restored but low pressure,water,medium
Bhubaneswar,Large pothole on main road near master plan crossroads,pothole,high
Cuttack,Streetlight not working at traffic signal near mandir,streetlight,medium
Rourkela,"Garbage piling up near market complex, smells",garbage,high
Berhampur,Water supply disrupted in old town due to pipeline leak,water,high
Sambalpur,Large pothole causing traffic delay on main road,pothole,medium
Puri,Streetlight flickering and going off at evening,streetlight,low
Balasore,Garbage dump not cleared; litter scattered,garbage,medium
Baripada,Water supply irregular in housing colony,water,medium
Jharsuguda,Pothole near bus stand causing damage to bikes,pothole,high
Angul,Non-functional streetlight near hospital gate,streetlight,low
Dhenkanal,Garbage not collected in ward 12 for 3 days,garbage,medium
Kendrapara,Collapsed drain leading to waterlogging on road,water,high
Bargarh,Pothole near school entrance; risk for students,pothole,high
Jeypore,Streetlight not functioning on main market road,streetlight,medium
Bhadrak,Garbage not collected in colony after rain,garbage,low
Rayagada,Water supply resumed after long outage,water,low
Paradeep,Pothole filled but reappears after rain,pothole,medium
Koraput,Streetlight outage near college campus,streetlight,high
Sundargarh,Garbage cart not collected this morning,garbage,low
Phulbani,Water leak in lane causing muddy road,water,medium
